{
  "schema": "netdryrun.report/v1",
  "status": "failed",
  "lab": "ndr-eval-t04",
  "config": "/mnt/c/Users/<user>/AppData/Local/Temp/ndr-eval/haiku3-fixed/T04-review-community/netdryrun.yml",
  "started": "2026-10-27T09:51:15+00:00",
  "finished": "2026-10-27T09:53:14+00:00",
  "error": null,
  "inconclusive_reason": null,
  "environment": {
    "netdryrun": "0.3.0",
    "containerlab": "0.81.1",
    "python": "3.10.12",
    "host": "Linux-6.18.54.1-microsoft-standard-WSL2-x86_64-with-glibc2.35",
    "nodes": {
      "edge1": {
        "kind": "linux",
        "image": "quay.io/frrouting/frr:10.4.1"
      },
      "cust1": {
        "kind": "linux",
        "image": "quay.io/frrouting/frr:10.4.1"
      },
      "up1": {
        "kind": "linux",
        "image": "quay.io/frrouting/frr:10.4.1"
      },
      "peer1": {
        "kind": "linux",
        "image": "quay.io/frrouting/frr:10.4.1"
      }
    }
  },
  "summary": {
    "passed": 11,
    "failed": 2,
    "total": 13
  },
  "checks": [
    {
      "name": "TICKET up1 gets our block with community 65200:100",
      "type": "bgp_route",
      "params": {
        "node": "up1",
        "prefix": "192.0.2.0/24",
        "communities": [
          "65200:100"
        ]
      },
      "passed": false,
      "detail": "missing communities 65200:100 (best path: as-path '65000', next hop 10.0.2.1, local-pref 100, MED 0, communities none)",
      "attempts": 27,
      "duration_s": 90.3,
      "started": "2026-10-27T09:51:16+00:00",
      "history": [
        {
          "t": 3.1,
          "passed": false,
          "detail": "no BGP path"
        },
        {
          "t": 8.3,
          "passed": false,
          "detail": "missing communities 65200:100 (best path: as-path '65000', next hop 10.0.2.1, local-pref 100, MED 0, communities none)"
        },
        {
          "t": 13.4,
          "passed": false,
          "detail": "missing communities 65200:100 (best path: as-path '65000', next hop 10.0.2.1, local-pref 100, MED 0, communities none)"
        },
        {
          "t": 17.1,
          "passed": false,
          "detail": "missing communities 65200:100 (best path: as-path '65000', next hop 10.0.2.1, local-pref 100, MED 0, communities none)"
        },
        {
          "t": 20.4,
          "passed": false,
          "detail": "missing communities 65200:100 (best path: as-path '65000', next hop 10.0.2.1, local-pref 100, MED 0, communities none)"
        },
        {
          "t": 23.7,
          "passed": false,
          "detail": "missing communities 65200:100 (best path: as-path '65000', next hop 10.0.2.1, local-pref 100, MED 0, communities none)"
        },
        {
          "t": 26.9,
          "passed": false,
          "detail": "missing communities 65200:100 (best path: as-path '65000', next hop 10.0.2.1, local-pref 100, MED 0, communities none)"
        },
        {
          "t": 30.2,
          "passed": false,
          "detail": "missing communities 65200:100 (best path: as-path '65000', next hop 10.0.2.1, local-pref 100, MED 0, communities none)"
        },
        {
          "t": 33.5,
          "passed": false,
          "detail": "missing communities 65200:100 (best path: as-path '65000', next hop 10.0.2.1, local-pref 100, MED 0, communities none)"
        },
        {
          "t": 36.8,
          "passed": false,
          "detail": "missing communities 65200:100 (best path: as-path '65000', next hop 10.0.2.1, local-pref 100, MED 0, communities none)"
        },
        {
          "t": 40.1,
          "passed": false,
          "detail": "missing communities 65200:100 (best path: as-path '65000', next hop 10.0.2.1, local-pref 100, MED 0, communities none)"
        },
        {
          "t": 43.4,
          "passed": false,
          "detail": "missing communities 65200:100 (best path: as-path '65000', next hop 10.0.2.1, local-pref 100, MED 0, communities none)"
        },
        {
          "t": 46.5,
          "passed": false,
          "detail": "missing communities 65200:100 (best path: as-path '65000', next hop 10.0.2.1, local-pref 100, MED 0, communities none)"
        },
        {
          "t": 49.8,
          "passed": false,
          "detail": "missing communities 65200:100 (best path: as-path '65000', next hop 10.0.2.1, local-pref 100, MED 0, communities none)"
        },
        {
          "t": 53.1,
          "passed": false,
          "detail": "missing communities 65200:100 (best path: as-path '65000', next hop 10.0.2.1, local-pref 100, MED 0, communities none)"
        },
        {
          "t": 56.3,
          "passed": false,
          "detail": "missing communities 65200:100 (best path: as-path '65000', next hop 10.0.2.1, local-pref 100, MED 0, communities none)"
        },
        {
          "t": 59.6,
          "passed": false,
          "detail": "missing communities 65200:100 (best path: as-path '65000', next hop 10.0.2.1, local-pref 100, MED 0, communities none)"
        },
        {
          "t": 62.8,
          "passed": false,
          "detail": "missing communities 65200:100 (best path: as-path '65000', next hop 10.0.2.1, local-pref 100, MED 0, communities none)"
        },
        {
          "t": 66.1,
          "passed": false,
          "detail": "missing communities 65200:100 (best path: as-path '65000', next hop 10.0.2.1, local-pref 100, MED 0, communities none)"
        },
        {
          "t": 69.2,
          "passed": false,
          "detail": "missing communities 65200:100 (best path: as-path '65000', next hop 10.0.2.1, local-pref 100, MED 0, communities none)"
        },
        {
          "t": 72.4,
          "passed": false,
          "detail": "missing communities 65200:100 (best path: as-path '65000', next hop 10.0.2.1, local-pref 100, MED 0, communities none)"
        },
        {
          "t": 75.8,
          "passed": false,
          "detail": "missing communities 65200:100 (best path: as-path '65000', next hop 10.0.2.1, local-pref 100, MED 0, communities none)"
        },
        {
          "t": 79.3,
          "passed": false,
          "detail": "missing communities 65200:100 (best path: as-path '65000', next hop 10.0.2.1, local-pref 100, MED 0, communities none)"
        },
        {
          "t": 82.6,
          "passed": false,
          "detail": "missing communities 65200:100 (best path: as-path '65000', next hop 10.0.2.1, local-pref 100, MED 0, communities none)"
        },
        {
          "t": 86.1,
          "passed": false,
          "detail": "missing communities 65200:100 (best path: as-path '65000', next hop 10.0.2.1, local-pref 100, MED 0, communities none)"
        },
        {
          "t": 89.4,
          "passed": false,
          "detail": "missing communities 65200:100 (best path: as-path '65000', next hop 10.0.2.1, local-pref 100, MED 0, communities none)"
        },
        {
          "t": 90.3,
          "passed": false,
          "detail": "missing communities 65200:100 (best path: as-path '65000', next hop 10.0.2.1, local-pref 100, MED 0, communities none)"
        }
      ],
      "evidence": [
        {
          "node": "up1",
          "cmd": "vtysh -c show bgp ipv4 unicast 192.0.2.0/24 json",
          "rc": 0,
          "output": "{\n  \"prefix\":\"192.0.2.0/24\",\n  \"version\":2,\n  \"advertisedTo\":{\n    \"10.0.2.1\":{\n      \"hostname\":\"edge1\"\n    }\n  },\n  \"pathCount\":1,\n  \"paths\":[\n    {\n      \"aspath\":{\n        \"string\":\"65000\",\n        \"segments\":[\n          {\n            \"type\":\"as-sequence\",\n            \"list\":[\n              65000\n            ]\n          }\n        ],\n        \"length\":1\n      },\n      \"origin\":\"IGP\",\n      \"metric\":0,\n      \"valid\":true,\n      \"version\":2,\n      \"bestpath\":{\n        \"bestpathFromAs\":65000,\n        \"overall\":true,\n        \"selectionReason\":\"First path received\"\n      },\n      \"extendedCommunity\":{\n        \"string\":\"RT:65200:100\"\n      },\n      \"lastUpdate\":{\n        \"epoch\":1793094687,\n        \"string\":\"Tue Oct 27 09:51:27 2026\"\n      },\n      \"nexthops\":[\n        {\n          \"ip\":\"10.0.2.1\",\n          \"hostname\":\"edge1\",\n          \"afi\":\"ipv4\",\n          \"metric\":0,\n          \"accessible\":true,\n          \"used\":true\n        }\n      ],\n      \"peer\":{\n        \"peerId\":\"10.0.2.1\",\n        \"routerId\":\"192.0.2.1\",\n        \"hostname\":\"edge1\",\n        \"domainname\":\"localdomain\",\n        \"type\":\"external\"\n      }\n    }\n  ]\n}\n",
          "stderr": ""
        },
        {
          "node": "up1",
          "cmd": "vtysh -c show bgp ipv4 unicast 255.255.255.255/32 longer-prefixes json",
          "rc": 0,
          "output": "{\n \"vrfId\": 0,\n \"vrfName\": \"default\",\n \"tableVersion\": 3,\n \"routerId\": \"203.0.113.1\",\n \"defaultLocPrf\": 100,\n \"localAS\": 65200,\n \"routes\": {  } , \"totalRoutes\": 0, \"totalPaths\": 3 } \n",
          "stderr": ""
        }
      ]
    },
    {
      "name": "TICKET up1 gets the customer's block with community 65200:100",
      "type": "bgp_route",
      "params": {
        "node": "up1",
        "prefix": "10.100.0.0/24",
        "communities": [
          "65200:100"
        ]
      },
      "passed": false,
      "detail": "missing communities 65200:100 (best path: as-path '65000 65100', next hop 10.0.2.1, local-pref 100, MED 0, communities none)",
      "attempts": 27,
      "duration_s": 90.3,
      "started": "2026-10-27T09:51:16+00:00",
      "history": [
        {
          "t": 3.1,
          "passed": false,
          "detail": "no BGP path"
        },
        {
          "t": 8.3,
          "passed": false,
          "detail": "missing communities 65200:100 (best path: as-path '65000 65100', next hop 10.0.2.1, local-pref 100, MED 0, communities none)"
        },
        {
          "t": 13.4,
          "passed": false,